{
  "$schema": "../schema/schema.json",
  "common": {
    "name": "Meteoalarm Card",
    "description": "Meteoalarm kartica vas upozorava na trenutne vremenske događaje.",
    "expected": "Očekivano",
    "unavailable": {
      "long": "Integracija nije dostupna",
      "short": "Nedostupno"
    }
  },
  "error": {
    "missing_entity": "Potrebno je navesti entitete!",
    "invalid_integration": "Ova integracija nije važeća!",
    "invalid_scaling_mode": "Ovaj režim skaliranja nije važeći!",
    "entity_invalid": {
      "single": "Izabrana integracija ne odgovara izabranom entitetu.",
      "multiple": "Izabrana integracija ne odgovara izabranim entitetima: {entity}."
    }
  },
  "editor": {
    "entity": "Entitet",
    "entities": "Entiteti",
    "integration": "Integracija",
    "required": "Obavezno",
    "recommended": "Preporučeno",
    "override_headline": "Zameni naslov koji daje integracija",
    "hide_when_no_warning": "Sakrij kada nema upozorenja",
    "hide_caption": "Sakrij natpis",
    "disable_swiper": "Onemogući klizač upozorenja",
    "description": {
      "start": "Izabrana integracija kreira više entiteta.",
      "current_expected": "Prvi sa trenutnim događajima i drugi sa budućim.",
      "slots": "Tačan broj kreiranih entiteta određuje konfiguracija.",
      "separate_events": "Svaka vrsta događaja ima poseban entitet.",
      "warning_watch_statement_advisory": "Postoje 4 entiteta: upozorenja, nadzori, saopštenja i saveti.",
      "end": "Dodajte sve da biste bili sigurni da nećete propustiti nijedno upozorenje."
    },
    "error": {
      "expected_entity": "Očekivani entitet upozorenja nije obezbeđen. Budući događaj neće biti prikazan.",
      "too_many_entities": "Obezbeđeno je više entiteta nego što je očekivano. Očekivano {expected_entities_count}, dobijeno {selected_entities_count}.",
      "duplicate": "Pronađeni duplikati u listi entiteta."
    },
    "scaling_mode": "Režim skaliranja",
    "scaling_mode_options": {
      "disabled": "Onemogućeno",
      "headline": "Samo naslov",
      "scale": "Samo skala",
      "headline_and_scale": "Naslov i skala"
    }
  },
  "events": {
    "no_warnings": "Nema upozorenja",
    "nuclear": "nuklearni akcedent",
    "tornado": "tornado",
    "hurricane": "uragan",
    "wind": "vetar",
    "earthquake": "zemljotres",
    "volcano": "vulkan",
    "snow_ice": "sneg/led",
    "fog": "magla",
    "high_temperature": "visoka temperatura",
    "low_temperature": "niska temperatura",
    "coastal_event": "obalni događaj",
    "tsunami": "tsunami",
    "sea_event": "nepogode na moru",
    "forest_fire": "šumski požar",
    "avalanches": "lavine",
    "thunderstorms": "grmljavinske oluje",
    "rain": "kiša",
    "flooding": "poplave",
    "air_quality": "kvalitet vazduha",
    "dust": "prašina"
  },
  "messages": {
    "yellow": {
      "event": "Žuto upozorenje za {event}",
      "generic": "Žuto upozorenje",
      "color": "Žuto"
    },
    "orange": {
      "event": "Narandžasto upozorenje za {event}",
      "generic": "Narandžasto upozorenje",
      "color": "Narandžasto"
    },
    "red": {
      "event": "Crveno upozorenje za {event}",
      "generic": "Crveno upozorenje",
      "color": "Crveno"
    }
  }
}
