{
  "$schema": "../schema/schema.json",
  "common": {
    "name": "Meteoalarm Card",
    "description": "Метеоаларм картица вас упозорава на тренутне временске догађаје.",
    "expected": "Очекивано",
    "unavailable": {
      "long": "Интеграција није доступна",
      "short": "Недоступно"
    }
  },
  "error": {
    "missing_entity": "Потребно је навести ентитете!",
    "invalid_integration": "Ова интеграција није важећа!",
    "invalid_scaling_mode": "Овај режим скалирања није важећи!",
    "entity_invalid": {
      "single": "Изабрана интеграција не одговара изабраном ентитету.",
      "multiple": "Изабрана интеграција не одговара изабраним ентитетима: {entity}."
    }
  },
  "editor": {
    "entity": "Ентитет",
    "entities": "Ентитети",
    "integration": "Интеграција",
    "required": "Обавезно",
    "recommended": "Препоручено",
    "override_headline": "Замени наслов који даје интеграција",
    "hide_when_no_warning": "Сакриј када нема упозорења",
    "hide_caption": "Сакриј натпис",
    "disable_swiper": "Онемогући клизач упозорења",
    "description": {
      "start": "Изабрана интеграција креира више ентитета.",
      "current_expected": "Први са тренутним догађајима и други са будућим.",
      "slots": "Тачан број креираних ентитета одређује конфигурација.",
      "separate_events": "Свака врста догађаја има посебан ентитет.",
      "warning_watch_statement_advisory": "Постоје 4 ентитета: упозорења, надзори, саопштења и савети.",
      "end": "Додајте све да бисте били сигурни да нећете пропустити ниједно упозорење."
    },
    "error": {
      "expected_entity": "Очекивани ентитет упозорења није обезбеђен. Будући догађај неће бити приказан.",
      "too_many_entities": "Обезбеђено је више ентитета него што је очекивано. Очекивано {expected_entities_count}, добијено {selected_entities_count}.",
      "duplicate": "Пронађени дупликати у листи ентитета."
    },
    "scaling_mode": "Режим скалирања",
    "scaling_mode_options": {
      "disabled": "Онемогућено",
      "headline": "Само наслов",
      "scale": "Само скала",
      "headline_and_scale": "Наслов и скала"
    }
  },
  "events": {
    "no_warnings": "Нема упозорења",
    "nuclear": "нуклеарни акцидент",
    "tornado": "торнадо",
    "hurricane": "ураган",
    "wind": "ветар",
    "earthquake": "земљотрес",
    "volcano": "вулкан",
    "snow_ice": "снег/лед",
    "fog": "магла",
    "high_temperature": "висока температура",
    "low_temperature": "ниска температура",
    "coastal_event": "обални догађај",
    "tsunami": "цунами",
    "sea_event": "непогоде на мору",
    "forest_fire": "шумски пожар",
    "avalanches": "лавине",
    "thunderstorms": "грмљавинске олује",
    "rain": "киша",
    "flooding": "поплаве",
    "air_quality": "квалитет ваздуха",
    "dust": "прашина"
  },
  "messages": {
    "yellow": {
      "event": "Жуто упозорење за {event}",
      "generic": "Жуто упозорење",
      "color": "Жуто"
    },
    "orange": {
      "event": "Наранџасто упозорење за {event}",
      "generic": "Наранџасто упозорење",
      "color": "Наранџасто"
    },
    "red": {
      "event": "Црвено упозорење за {event}",
      "generic": "Црвено упозорење",
      "color": "Црвено"
    }
  }
}
